{
  "schema_version": "1.0",
  "task_id": "sample_001",
  "module": "m3_calibration_calculation",
  "status": "ok",
  "lens_type": "spherical",
  "result": {
    "S": -2.50,
    "C": 0.00,
    "A": null,
    "unit": "D",
    "angle_unit": "degree"
  },
  "quality": {
    "is_usable": true,
    "confidence": 0.91,
    "warnings": ["MOCK_DATA_ONLY"]
  },
  "intermediate": {
    "coordinate_system_valid": true,
    "coordinate_type_before": "image_pixel",
    "coordinate_type_after": "calibration_pixel",
    "shift_unit": "pixel",
    "shift_y_positive": {"dx": 0.82, "dy": 2.60},
    "shift_x_positive": {"dx": -1.38, "dy": 0.78}
  },
  "error": null
}
